['drake']	The Presentation	shake world bout homie even altitude tellin got enough cloud two like nxgga turn blood came blue like damn drake wheelchairjimmy chris brown shxt still gimme dat cuttin lights like bedtime rappers lukewarm like redwine truth hurts please rub signed yet still budgetin like jeopardyi still buzzin every city gotta nephew cousin ugh miss cake days even afford mistake days favorite girls miss drake days please take offense ways  cause need drug money got drug money talkin white phantom sittin dub money talkin cold champaigne tha club money emotional baby love money ars playin stars gotta act dumb dumb girl kno beat like flat drum spit dirty like chewin black gum fooled yall shxt come back beat changes drake talking ooooohhh yes would like take opportunity formally welcome extravaganza call comeback season hope enjoy stay drinks way laughs yeah rapping fuck jay dame gon break meet drake sure resolved hopin make perfected craft using   tryna make cheese single process get  craft single cheese process sit back admire talent possess top notch less oh yes known city need bust like model show chest cause deal agents check collections keepin clean little x direction babygirl like probably due fact last like next selection city mine control know cause nothing like     jamaican doctor bay otis back form like opis go yeah teach learn right come ride need earn height hyrdo bill let lights burn take em back like returned flights yeah     rich united like   barmitsfa kidd get hits destroyed cause keep wraps like christmas toys witnesses mistresses present show wut gifted mayne keep real youngins hot gucci groupie nxgga prodigy direct cause check waited connects playin connect four playin uno doin know wuteva us rappers develop new flow promise yeah talking shout 4040 yeah right hand	
['drake']	Fear	drake talking shit think call uhm venting verse 1 look uhh still want hits play game auto tune feel pain comes spilling like hit vein lil braw slum ville hope know yall reason fun still fans thinking signed one mill equal opportunities rapping shit unreal works goes getting high balance lows could use writer balance flows never share thoughts nigga knows every time try opens eyes verses chance remembered reprised would performing long alive every word utter mine chorus believe lies look eyes please scared please scared remember feeling new please scared please scared oh oh oh oh oh uhh verse 2 never cried pac died probably hov tears hold value would drop one every single thing showed us standing puddle stay away niggas could land trouble ima keep honest tired subtle forty o neek standing huddle staring members team get questioned profit 40 million dollar scheme know debt defending dreams hope tell family shit seems yall reason lot devotion know spend money spending time hopeless know pop bottles cause bottle emotions least put open chorus believe lies look eyes please scared please scared remember feeling new please scared please scared oh oh oh oh oh uhh verse 3 look fuck yall ignore feelings premature millionaires welcome realest year yeah swear making killing top world chilling uh funny fans find anybody ever chance build could biggest game realize sometimes shit feel yeah plus things surreal home people think changed appeal grown security follow everywhere never actually alone always feel alone think scared future holds wishing things used every girl meet thinks fucking groupie hoes honesty music left exposed old friends think got new crowd people seem notice every time smile guess mean come far even though living would call dream yeah uncle even messaging missing life kind messing hope one forever things funny money change everything chorus believe lies look eyes please scared please scared remember feeling new please scared please scared oh oh oh oh oh uhh	
['drake']	Legend	pull nigga tell nigga back back good words watch nigga backtrack die know motherfucking legend late city youngest nigga reppin oh god oh god die legend oh god oh god die legend first tour got girl south used work used dance texas clean house everyday strugglin learn lifes way money taught spanish make andale way north packed honda cars ont know fuck em pussy niggas shooting star right wrong write wrongs live long know gonna go got shit mapped strong pull nigga tell nigga back back good words watch nigga backtrack know die motherfucking legend late city youngest nigga reppin oh god oh god die legend oh god oh god die legend one one feel like one feel like owe one 6 god holy one yeah know minute know sentimental know actin different pretend seen much hard let new people change shit set stone live long know gonna go got shit mapped strong pull nigga tell nigga back back good words watch nigga backtrack know die motherfucking legend late city youngest nigga reppin oh god oh god die legend oh god oh god die legend one	
['drake']	A Night Off	drake spending every moment studio would never said would fair alone hope truly know bad want chorus come right set bag took night go ahead turn lights keep heels fittin  explainin want done quiet fine without ya help girl work without second fun finally got moment yaself girl know know know know  oh oh adlibs lloyd waitin long get alone finally got right baby lock door disconnect phone cause wanna make one thing clear want top let ya hair took night girl gonna turn lights keep ya heels fittin  oh oh adlibs chorus come right set ya bag took night go ahead turn lights keep ya heels fittin  oh oh adlibs  explainin want done quiet fine without ya help girl work without second fun finally got moment yaself girl know know know know  oh oh 6 clock morning studio	
['drake']	Club Paradise	verse 1 say yo old girls got somebody new say damn really even rosemary even leanne seely  said fuckin right 1st go nothing personal women slept working though saving new niggas came around waking swear know city anymore might loved thing know  sure sincere crazy emotions forgot year like even give fuck even well nothing think need come home chorus tell leave behind think got read mind think caught right believe remember verse 2 nigga chubbs love street shit wonder feel awkward fashion week shit wonder keep fucking double cheek kiss along ignorant young money miami beach shit couple artists got words never fun say see day ever come never scared never real never run said done always said done told things change nigga named tip deal came told good even feels strange guy know strippers real names rochelle jordanne thick bitches talked 4 grand pile kush become mountain truth bottle wine become fountain youth damn biggest fear losing remember used feel start living muthafuckin fairy tale still trying keep feeling part yea lie ears tell feel dying hear lights get low brightest ideas heard city feel better ever gotta come home chorus tell leave behind think got read mind think caught right believe remember verse 3 mother back years ago like new page beginning wish stopped checking women stand got new girls could use opinion thinks become slave wealth never break promises made would never make names change names gave certain rappers would call say wat doe used brag friends feeling like niggas cutthroat maybe pretend damn bought though believed yea thought achieved yea show love show fucking love thought needed yea clearly wrong along year even feel shit trip amount people brought along trying surrounded real shit need credentials everyone toronto kids promise see tryna live told em bout get finally listen closely shit swear sounded like home chorus tell leave behind think got read mind think caught right believe remember outro bob marley	
['drake']	Replacement Girl	echotrey songz ladies make noise wanna replacement verse 1drake lat show born top raised bottom map girls thick hottest niggas rap lookin goods got trap like trey ooo wee drake took em white snakes trey ooo wee drake metaphore might sound little confusing trey yall really even know yeah yeah drake done come way days inn hotels stayed took lifestyle mediocre good say sittin amazing girls tryin sell whole lobby us  hear em screamin probably blame females females really ignore something obvious really expect strut town two three days shut chilin wit homie trey songz call prince rep two two anyone know get used im far man used  ever really kick game know find impressing whenever introduced good dude take pride need good lovin providing understand worldwide get want wherever residing things mtown uk spain back texas albums fans yo hook exes chorustrey songz one girl know girl show face know star girl trying make ever mistake time limited trying waste  chance gone oooooh man  back basics think made ladies make noise wanna replacement girl verse 2trey songz ya never seen yougin fly lookin someone type done left behind love life tryin find another one tonight baby let seen don matter skirts dresses jeans got work know mean flexing ex know mean chorus verse 3drake check get picked take slip break another story drakes house dripped drapped lean back scoping looking woman wife got right amount loyalty yeah still anticipating us living good life go la va ny sunshine heat stroke fur hoods deep snow breakfast bedroom break bread downstairs basement since jay kelz thing guess boy songz replacement chorus  ay ay ay ay ay ay ay ay ay ay ay ay ay let us go	
['drake']	KMT	drake ness beat yeah okay okay okay b man got gave bro advance yeah love plans even takin chance studio right yard doin ten week long streak dream work sleep okay got lock streets shoutout t three brought know nothin bout life bruddas deep long feet long pockets grease grease penthouse still nothin sweet yeah dust man pen sweep mmmm taller person see meet heard new shit kissin teeth jheeze giggs bringin dirty dirty bringin certy nizzy quick extension ringin thirty got bitches murky swervin lookin curvy already know love breasts lookin perky lookin christmas giftwrapped lookin turkey spend jumped ghost suit lookin churchy fingers itchin twitchin lookin jerky whippin white girl cookin cersei pushin dark shit pushin charcoal big bad gustavo look jokers look arsehole man gettin bread hard dough clap man dominant murder black man government earner could slapped man wanted batman dananadana october firm	
['drake']	9 A.M. In Dallas Freestyle	yeah uh yeah one st thomas flows niggas madonna hoes look like virgins trust go discussin life common goals smart kids smoke weed honor roll look champagne diamonds flow fine dining pour another another glass wine low im crib stackin money ceilin whatever got clearly appealin rappers gettin inferior feelin hope feel soul spiritual healin take look mirrors revealin got got theory brilliant people ask music goin heard pays came makin 2 million 30 days damn guess message sometimes feel spendin money weezy reppin us till get shake hand man blessin us yeah know niggas miss mean lyrics kush got room smellin like teen spirit asked kindly noone would bring feet lose games single leader fly private noone tells bring seat book suite favorite singer meet like tell imma make sure women next one list call night fuck resist one niggas city tryin diss without response really fail exist love see fail feelin shit swear aghh pussy nigga get bread enjoy seat steward forced ass let scary ass lookin pick head noone told disguise ridiculous gettup nose plugs smell set wastin time makin better yeah try tell judge heard stuff chasin cash brother surf club damn nigga always kept hood back would smoke good oakwoods girls fall like coins couch fuckin bitches warned us scared first time everything clicked dont really numbers predict considerin fact one picked write chapter history shit got sick really dont expect get split cause truly shit expect get im nervous kill cause let realist team throwin huddle nigga willie beamin still throwin touchdown passes tore frame glasses hopin someone catch people say oh drake started miss need little specific man yall want best chris tucker impression ducking questions fuck suggestions money gets love affection cars black like cover essence allergic comin second never sneeze nigga ymoe nigga yeeah uh yeah want yall want octobers very young money atf thank later bitch wasssup free weezy bitch wasup june 15th bitch wasup	
['drake']	Hold On We're Going Home (Remix)	intro rick ross shorty got money ever thing need right  make simple new thing ha ha ha ha verse 1 rick ross fuck like addict fuck like mad cool though flew aneisha last week away send pics sheets saw grin cars sneaks wait let keep shit simple fuck radio shit nigga tempo fat boy blue jeans gold watch started bottom rolled top black testerosa zero sixty strip explosive got back dubai emirates live flew 15 never fold threshold like mother sayin never let go hood nigga escrow bad bitch special went home prayed angel appeared dark take away pain war wombs big dog get ball like tip watch dwade got two seats got everything blue beach cartier wings nigga two seats nigga gettin money like new meech knights templar dirty little nigga ten cars whole clique another enron baby girl time get gone heres shoulder lean rozay baby team strong verse 2 drake got eyes everything see want hot love emotion endlessly get left mark want hot love emotion endlessly chorus drake cause good girl know act different around cause good girl know know exactly could hold going home hold going home hard things alone hold going home ohhohh oh ohhhh verse 3 drake got eyes everything see want hot love emotion endlessly get left mark want hot love emotion endlessly chorus drake majid jordan cause good girl know ohh yeah act different around lada dah daaah cause good girl know lada dah know exactly could hold going home going home hold going home going home hard things alone things alone hold going home going home ohhohh oh ohhhh going home interlude 2x majid jordan girl one gave every thing loved think something baby think something baby chorus drake majid jordan cause good girl know act different around cause good girl know know exactly could ohh hold going home going home hold going home going home hard things alone things alone hold going home going home ohhohh oh ohhhh going home	
['drake']	Controlla	popcaan amp drake gyal yuh body good yuh special meh wan mek mi lady officially tickets fi buy den mi willing pay fly yuh distance away right yiy changed buzzed front gate thank god came many days could wait made plans let em fall drake think would lie think would die jodeci cry things want like controlla controlla yeah like controlla controlla yeah okay like get aggressive tell go slower go faster like controlla controlla yeah like controlla controlla yeah i’m never wasting shorty say want girls wanna take money want give nothing want nothing wanna see find lovin wanna see smiling back pree knowing would lie thinking would die jodeci cry things want like controlla controlla yeah like controlla controlla popcaan baby yuh mek mi happy wine yuh sexy body fi papi yuh eyesthem looking an’ turn mi like new bugatti naughty tings mi wan mi woulda love yuh coulda come mek smoke spliff drink den mi release yuh stress ah yorkville avenue sexiness pro mek mi bend inna ya bra ya shoes baby wah mek rude pretty inna clothes mi love yuh nude baby tek nuttin fi move meh yuh bad like action movie say fi rough tonight smoothly mi love unruly drake think would lie thinking would die jodeci cry things want like controlla controlla yeah like controlla controlla popcaan love dweet night mek clap ride bike cock pan di private flight fi mi lace ‘ar like mi bran’ new nike mi say mi want ‘ar life sing mi note pan di cordless mic mi want ‘ar life life mi see say yuh sexiness pro mek mi bend inna ya bra ya shoes baby wah mek rude pretty inna clothes mi love yuh nude baby tek nuttin fi move meh yuh bad like action movie say fi rough tonight smoothly mi love unruly drake think would lie think would die jodeci cry things want like controlla controlla yeah like controlla controlla	
['travis+scott']	Basement Freestyle	intro got nigga easy motherfucker dead stock sixes shit got nigga metro motherfucker verse 1 buy bar buy bar bitches table everywhere floor condoms dresser business never plannin never sober thinkin blew body shots took bitches titties slow pick fuck third speed fourth gear grindin everything mine got everything ever asked gettin far mamas jeep never tinted frozed unfrozed come little closer get ass wall go roll doja tell boyfriend bust ki go ahead fill nose till lookin hoes trophies grab glass go ahead get throwed feelin spill shit crazy goin goin gone hook money table want relations want conversations fuck around change world damn main bitch love mo drinkin fuck limitations done made basement fuck around change weather verse 2 bean bean shit lean dreams stove wanna smoke road might roll let us get throwed houston know name mo city know gang young la flame nothin changed chains diamond rings lost brains ye ye broad day 3rd coast eatin  merlot got shirt kickin dirt bergdorf like doin took path get give damn ruined later got ring ring ring doorbell ding ding ding ding let bitch bitch seen bang bang couch floor mouth cameras dicks pulling bridge baby straight bitch coke since 80s 90s baby young la flame know crazy hook	
['travis+scott']	Through The Late Night	kid cudi sleep day play late night sleep day play late night uh uh uh uh uh uh late night sil vous plaît hate late night late night late night late night late night late night late night late night late night blimps soarin hell get space four mornin get place oh matter got smoke drink runnin space done contemplatin ama take groove case n ndimethyltryptamine lysergic acid diethylamide vibes effervescent delicious n ndimethyltryptamine lysergic acid diethylamide vibes effervescent delicious sleep bed sleepin bed yeah gon play gon play gon day said sleep bed sleepin bed yeah gon play gon play sleep day kid cudi amp travis scott sleep day play late night sleep day play late night uh uh uh uh uh uh late night sil vous plaît hate late night late night late night late night late night late night late night late night late night travis scott day night toss turn keep stressin mind mind seek peace sometimes restrain join rage night come play play balance find balance god said talent sprinkle little season salad relieve heart malice hit palace stroke cactus oh wait play play games like nba throwin checks like nba ring ring shootin shots like nra ahh jammin travis kid cudi new krayzie bone slim bun b ah shawty scene pull scene sip tea hennessy aw save take right aw take never light aw ball night aw sleep good kid cudi sleep day play late night sleep day play late night uh uh uh uh uh uh late night sil vous plaît  hate late night late night late night late night late night late night late night late night late night	
['travis+scott']	Chaz Interlude	toro y moi  repeat 2x existence miss keep want nothing like secret crushes king fix	
['travis+scott']	Huncho Jack	mmmmurda huncho farm huncho got bitch porn smash smash whips foreign skrrt iced arm ice shine cactus jack yeah got plaques plaques yeah hits hits yeah mix huncho farm huncho got bitch porn yeah smash whips foreign skrrt skrrt ice arms ice ice shit go bad like la traffic yeah crushin addy yeah bustin plastic yeah huncho basic basic basic basic fuck basic keep squad upgraded max number one shooter like tracy shoot tonka truck mercedes tonka drivin faded skrrt block invadin block guns updated 5 lookin like noon yeah took right saloon lit put 5 back got room fit chicks got room straight yeah new crib put moon upstairs blowin fumes yeah panic seizures fuck cashin leisure lot targets foes yeah took like stole skrt skrt got old shit moldy ugh money way high knees way fold yeah thinkin golden aie suck voltage alright huncho farm huncho got bitch porn smash smash whips foreign skrrt iced arm ice shine cactus jack yeah got plaques plaques hits hits yeah mix lit huncho farm huncho got bitch porn yeah smash whips foreign skrrt skrrt ice arms ice ice shit go bad like la traffic yeah crushin addy yeah bustin plastic yeah huncho flood ap make hoes wanna take take gun safety safety shoot fuck nigga like kd yeah bow shit brazy brazy made left eye lazy yeah goin lately yeah dock back old navy yeah alright gonna get get trap house look innocent innocent private residence private leavin evidence evidence yeah yeah codeine medicine yeah somethin evident yeah tease hell yeah next tellin yeah closet filled designer designer take knee like niners kaepernick join team divide us join watch money go higher lil help lil guidance run back title get sack move silence bring trophy back place huncho farm huncho got bitch porn smash smash whips foreign skrrt iced arm ice shine cactus jack yeah got plaques plaques yeah alright hits hits yeah mix lit huncho farm huncho got bitch porn yeah smash whips foreign skrrt skrrt ice arms ice ice shit go bad like la traffic yeah crushin addy yeah bustin plastic yeah huncho jack	
['travis+scott']	Too Many Chances	could real two seconds maybe minute oh yeah could real two seconds maybe minute shy could real two seconds first order business gotta fly people way many fakes face see evils drug addictions bad bitches gotta chose see peacoat black slacks rip clothes see amigos laid back cock nino game time gang time time reload handle mine take mine gotta deebo waste minute rap yates master business still menace peep mojo got together bag many looks pocket watchin gotta hit gas look back see clouds niggas doubt say niggad never make look yeah yeah yeah yeah yeah yeah hood times never cared pull outside club club yeah gave many chances gave many chances alcohol dancers gave many gave many chances gave many chances alcohol dancers gave many could real two seconds maybe minute oh yeah could real two seconds maybe minute shy could real two seconds look back see clouds niggas doubt say niggad never make look yeah yeah yeah yeah yeah yeah hood times never cared pull outside club club yeah gave many chances gave many chances alcohol dancers gave many gave many chances gave many chances alcohol dancers gave many gave many chances gave many chances alcohol dancers gave many could real two seconds maybe minute oh yeah could real two seconds maybe minute shy could real two seconds know  shy know know	
['travis+scott']	CAN'T SAY	travis scott say mad smoking hella weed alcohol shawty lick clean way suck keep two hoes bed got em turning would heard got going burn left skrt marks dip gotta watch 12 round town might get killed better watch 12 mind yea high rim mind cop live boy got film gotta watch rocking shit get real drink real fake know feel gotta take long drive hill gang wavy move like navy seals wavy think need lyft chicago baby wanna drill vibes wavy hard kill gotta watch go shit get real don toliver say mad smoking hella weed alcohol shawty lick clean way suck keep two hoes bed got em turning would heard got burned let burn skrt mark dip better watch 12 round town might get killed better watch 12 mind yea high rim mind cop live boy got film must cautious told lil hoes play ballers offense left ol girl callin know hit morning oh yeah yawning met club bitch know shit nothing oh hit cousin mhm discussion sipping lean robitussin oh yea know love beat cuddling bad suffering give fuck hard get lil bitch know started uh huh oh yea get cash layup spend big bag rodeo may ride first time hoes come touch us ama tell truth like usher already know bust slang chop russia ama swang swang swang left pop pop trunk dip dip dip dip ama swang swang swang left pop pop trunk dip travis scott say mad smoking hella weed alcohol shawty lick clean way suck keep two hoes bed got em turning would heard got going burn left skrt marks dip gotta watch 12 round town might get killed mind yeah high real cop live boy got film	
['travis+scott']	First Take	travis scott like saw life without despite lost despite got flaws let love play course let tell mine signs ignored play love like sport yeah first take time late around safe lit go around fuck heresay know look face think winnin race think play yeah put place still place yeah thought yeah also think much know think much know tryna go back war morals yeah kill vibe immortal straight buyin even though afford cause know like saw life without despite lost despite got flaws let love play course let tell mine signs ignored play love like sport yeah love grow less find growth white nose girl come let us find hoes let us fuck think hard know think hard know say nothin nothin cause think hard know yeah know would rather lead follow mano y mano baby cause know know travis scott bryson tiller like saw yeah life without yeah yeah despite lost ayy despite got flaws ayy let love play course ohhh let tell mine signs ignored uh huh play love like sport like sport yeah bryson tiller okay lil mama still heard lil mama go back angliana studying college called brought santa monica believed sponsor got love love gave affection girl lost gave direction went fuckin protection blessings girl wanted blessings think care girl better call best friend got time waste girl got time waste girl cancelled everything get back page finish story would rather ignore mama called check even pick phone yea shit goddamn feelin hollywood got nigga wealth free tonight bet call somebody else tryna tell last real nigga left hit need help love problems money problems might solve em might solve em might solve em might solve em might solve em call could pick phone baby know know home baby baby know know	
