['travis+scott']	Drugs You Should Try It	try feels right feels nice lost days glad found way day gets brighter night gets nighter always feel way hills hear callin miles miles away night dawn dusk always poppin fell love fell outta love options played drums rolled drugs rocked club throw band never heard got tat crack cat right back momma never know rollin rollin rollin rollin stones alone wish clone take puff take puff know never care overdose try feels right ohh feels nice lost days glad found way day gets brighter night gets nighter always feel way hills hear callin miles miles away shit try feels nice shit kinda feels nice mmmhm mhm ay miles miles away home alone mood know wanna move know wanna dance know gettin ready take night away home alone mood know wanna move know wanna dance know gettin ready chase night away	
['travis+scott']	Zoom	gotta say ya got zoom big rock diamonds yao ming yoom purple lemonade puffin fumes heatin like last day june niggas stealin drip shit cool see gunna gettin tags let floss jewels  face pay groom time way takin soon cash drip tryna fly moon lookin like gunna runner move like yeah got foreigns moving fleet travis like security find right meet room know name know tunes pass  see shoutout  try none brothers brothers try try one us get put news pull new bentley truck bag full money hunnids blue know proud ap apologies talk  prada tee purchase new amiri jeans young gunna drip god fly wings let use card secure needs tell girl pearls beads gettin high sky without weed	
['travis+scott']	Zombies	intro kids sing yea like like kids sing hook understand want bullshit verse 1 alright alright alright take many martinis slip straight bikini let grand slam outside dennys gone get oscar proud pay us pennys amma need dollars stack till envy ya feel kids need get feedback sit back relax relapse yo ass gone die blow high coastin beatin lotus loud talk like dope never notice feelin nigga cause sober ballin game players behind coaches come take trip lair third coast come floatin la di da di da di kids shout party hook interlude know fourteen wanted lot kick ass shit yeah verse 2 pornographic dramatic cinematic diamond flashes drastic dress classic roll cabbage get put casket dope fanatic baddest sarcastic laughin baddest traffic foreign gym baggin stuffed suburban twelve bitches straight beauty pageant know reebok keep la feet hot shipping package gl 600 palace collab classics tell need got everything green money money money trees buy everything bitch need wedding ring need bean boy walked mall boy need beam done fucked twice bought fendi things done sipped act imma leany fiend need team got kids kids gone sing hook	
['travis+scott']	Quintana	 Pt. 2	verse 1 travis scott one thing bitches got finessing designer straight oh god rental compared need remind robbed plug nigga getting higher dope oh oh stuck black true religion straight shit keep geekin fucked bout 5 bad bitches morning goin back unless horny oh oh hook finessing finessing go one day without finessing finessing finessing argument straight finessing finessing finessing argument straight finessing straight straight argument straight finessing weed team rolling team yeah finessing verse 2 ti man go fishcale a1 perico fill pjs kilos sell like legal everybody know could gotten hit rico caught couple charges weak though feds let go week still still need key blow whole heap dough ran streets long man team damn seem like long ago em mexico tryna make bet three bricks people always run us texas though grace god catch though lil young nigga big dreams almost verge big things tryna get bird since sixteen playin around fifteen know nigga love nice things price hood frightening niggas gon right thing except thing hook outro tell wanna leave used get high used get higher higher higher tell wanna leave ooh ooh oohh ooh ooh days go southern region national anthem quest la flame journey last days
['travis+scott']	Dubai Shit	yung lean could jump bridge let walk tend stay inside want take travis scott jet skiin jet skiin dubai jet skiin jet skiin dubai dubai shit dubai whips different place different chips atl shit ludicrous yah yah oh well like like straight yeah dubai shit dubai whips lit different place different chips yeah atl shit ludicrous alright know well know yah know go yah life round hysterical oh check sneakin lit get handle lit enemies mia ace diamonds ace spades yeah kauai mandalay yeah yeah get nah travis scott quavo dubai shit dubai whips different place different chips atl shit ludicrous luda yeah ayy know well know quavo quavo trampoline trampo michael jordan dreams jordan half bale vacuum clean bale abu dhabi jetskis skrrt skrrt splash want straight cash checks please cash shoot coupe brrt gon handin allowances goons gang dubai smokin cookie hotel rooms cookie got paranoid think esco move travis scott dubai shit dubai whips different place different chips atl shit ludicrous yah yah oh well like like straight oh yeah birds fly high dubai ridin jetskis dubai ayy much money jetski goes oh yeah quavo fish bowl fishes super bowl super bowl played montana rice white rice offset huncho tellin lie oh hot dubai see soul eyes soul let opium dry drank quavo good drank drank mixed antidote anti put molly cac put snow montana offset never fan o came land nawf whippin pan stove stove whip til hand grow mold yeah travis scott dubai shit dubai whips different place different chips yeah yeah atl shit ludicrous yah yah know well know straight dubai shit dubai whips lit different place different chips yeah atl shit ludicrous alright know well know jet skiin jet skiin dubai jet skiin jet skiin dubai	
['travis+scott']	HIGHEST IN THE ROOM	got room fumes yeah fill mind ideas highest room lit hope make outta let us go saw eyes know gone see things might fear show back soon soon wanna hear got room uh legs wrapped around beard got fastest car zoom hope make outta feel alive say love lie yeah cross heart wanna die keep pistol side case fumes smoke fill mind ideas straight highest room lit hope make outta let us go stressing bout loot block made caserío molly boot coming back live life la familia much gang see ya turn till hear running running round thrill yeah dog dog round real damn raw raw pouring rim drank naw naw naw back vip vip gorgeous baby keep hard steel ah life choose huh since kids gon stay top break rules uh fill mind ideas case fumes fill mind ideas straight highest room highest lit hope make outta outta highest might got midas touch brightest bitch vibiest excited everything exciting play giants little bit extravagant	
['ed+sheeran']	How Would You Feel (Paean)	one girl know true feeling younger every time alone sitting parked car stealing kisses front yard got questions ask would feel told loved something want taking time spending life falling deeper love tell love summer lilacs bloom love flows deeper river every moment spend sat upon best friends roof arms round watching sunrise replace moon would feel told loved something want taking time spending life falling deeper love tell love sitting parked car stealing kisses front yard got questions ask would feel told loved something want taking time spending life falling deeper love tell love tell love tell love	
['ed+sheeran']	Last Night	went late last night cold air met lost grip shoes walked home bare feet stay awake till morning greets stay away tonight day end fire keep burning never gonna leave tonight fire keeps burning never gonna leave let dark cover hold tight hear words sleep close eyes second life within stay awake till morning greets stay away tonight day end fire keeps burning never gonna leave tonight fire keeps burning never gonna leave outside winter cold asked go oh alone waiting tonight waiting tonight day end fire burning ever gonna leave oh oh ever gonna leave tonight meet ya tonight feel cold tonight ignore feet hurt without	
['ed+sheeran']	Take Me Back To London (Sir Spyro Remix)	jet plane headed sky spread wings clouds getting high hit rave sounds sir take back london yo yo deals never get twanged twanged moves ever planned planned goons never gangs gangs chat shit get banged chat shit let 12 gauge rip yeah sick fits hand hand mix glitz glam glam stupid pricks gram online beef neeky grime beef way gd beef grime neek bought ap help time keep shooter ride deep moves speak shooter ride ride shoot guy guy leave wet like scuba dived younger unified south london boys get crucified gone time big mike teddy grime wanna try new things want sing nobody thinks write rhymes back bits guy give packet crisps pint hit friends go straight pub home time yes fault oh grossed half billi divide tour oh yes kidding would lie oh back track big michael woah said teddy never get high horse never let em take crown away travelled million miles heading back london town right jet plane headed sky sky spread wings clouds getting high woop woop hit rave take back london bass high middle nights ceilin low ceilin low sweat brow drippin rome rome town quite like home take back to— birmingham 0121 stand better tell hooligans team lose outside quick twos beer see choose appear paid bag carpet blud take shoes yo turn boos cheers trip chunning man choose gears rep blues brum fam dumb red red wine want redrum forty wanna war end story gunna get spun man smoke weed til whole heads numb talk greaze take none vip section wild wild west old western brum old school raving back scally ap packed gally take back manny blacked roll full yack maggot s3 boot full packs cali hit booth man slap snap bap bap trap rap mappy man blessed bad trappy gets cold north pack hat trackie huh man made set pace young aitch came first place made change get paid fam stayed lane came flame day day stage make k skate catch next plane baking wake rake get saved make break make break human man still make mistake mad aitch made mixtape told jaykae make next eight bout set pace get gets bait get head get face want wants jay want wants aitch aye jaykae make lot p uh go straight got wait stop pop collar g 5 million minimum wanna see anything gonna put bed tell mumsy track ed aim one head write bars pen pad batterys dead jet plane headed sky 0161 spread wings clouds getting high 0121 hit rave sounds s take back london woo bass high middle nights ceilin low sweat brow drippin rome town quite like home like home take back london	
['ed+sheeran']	The A Team	white lips pale face breathing snowflakes burnt lungs sour taste lights gone days end struggling pay rent long nights strange men say class team stuck daydream way since eighteen lately face seems slowly sinking wasting crumbling like pastries scream worst things life come free us upper hand go mad couple grams want go outside tonight pipe flies motherland sells love another man cold outside angels fly angels fly ripped gloves raincoat tried swim stay afloat dry house wet clothes loose change bank notes wearyeyed dry throat call girl phone say class team stuck daydream way since eighteen lately face seems slowly sinking wasting crumbling like pastries scream worst things life come free us upper hand go mad couple grams want go outside tonight pipe flies motherland sells love another man cold outside angels fly angel die covered white closed eye hoping better life time fade tonight straight line say class team stuck daydream way since eighteen lately face seems slowly sinking wasting crumbling like pastries scream worst things life come free us upper hand go mad couple grams want go outside tonight pipe fly motherland sell love another man cold outside angels fly angels fly fly fly angels fly fly fly angels die	
['ed+sheeran']	Eraser	born inside small town lost state mind learned sing inside lords house stopped age nine forget get awards wave ride paving stones played upon kept grind blame pain blessed life friends family filled envy filled pride worlds really come alive every day satan tempts try take stride know got whisky white lies smoke lungs think life got point know without fun need get right mind clear instead look mirror questioning become guess stereotypical day someone like without nine five job uni degree caught trappings industry show locked doors find another use key see well aware certain things destroy man like said give one another one take sting away happy stay save loving arms rainy day find comfort pain eraser used think nothing could better touring world songs chased picture perfect life think painted wrong think money route evil fame hell relationships hearts fix break well nobody want see dumps living dream fun please know trying preach like reverend run beg disappointed man become conversations father a14 age 12 telling gotta chase dreams playing people dad know beaten small guitar wearing old jeans wembley stadium crowds two hundred forty thou may grown hope damians proud next generation inspirations allowed world may filled hate keep erasing somehow well aware certain things befall man like said give one another one take sting away oh happy stay well save loving arms rainy day find comfort pain eraser find comfort pain eraser find comfort pain eraser welcome new show guess know away heading knows heart stay welcome new show guess know away heading knows pain eraser find comfort pain eraser find comfort pain eraser find comfort pain eraser find comfort pain eraser	
['ed+sheeran']	Small Bump	small bump unborn four months brought life might left hair mothers eyes hold body hands gentle scan unmade plans small bump four months brought life whisper quietly give nothing truth inside put future one wrap fingers round thumb hold tight oh one wrap fingers round thumb hold tight alright oh small bump unknown grow skin smile like dimple beneath chin fingernails size half grain rice eyelids closed soon opened wide small bump four months open eyes hold tightly tell nothing truth inside put future one wrap fingers round thumb hold tight oh one wrap fingers round thumb hold tight alright lie tiny feet half asleep leave right front couple weeks keep safe one wrap fingers round thumb hold tight one wrap fingers round thumb hold tight alright small bump unborn four months torn life maybe needed still unaware	
['ed+sheeran']	Shirtsleeves	taste salt water blink sinking learn swim oceans made hold ya think pretty soon floating away hold words spoke anchored throat love captain sinking boat one armband carry home salted tears dry wipe shirtsleeves eyes hearts flooded tonight wipe shirtsleeves eyes eyes 5x still taste salt water lips kiss bitterness drown within oceans made hate love cuffs covered make never trust friend hold words spoke anchored throat love captain sinking boat one armband carry home salted tears dry wipe shirtsleeves eyes hearts flooded tonight wipe shirtsleeves eyes eyes lips mouth thighs back drive wild tonight fact way home way home lied tried cry drowning oceans made salted tears dry wipe shirtsleeves eyes hearts flooded tonight wipe shirtsleeves eyes eyes eyes eyes eyes eyes	
['ed+sheeran']	Fall	two mind love’s one kind we’re drifting edge fall fall fall would fall learning speak kisses cheeks we’re lifted edge fall fall fall would fall fall fall fall would fall would fall would fall would fall would fall	
['ed+sheeran']	All Of The Stars	another night staring moon saw shooting star thought sang lullaby waterside knew would sing side skyline splits two miles away seeing see stars america wonder see open eyes see way horizons meet lights lead night know scars bleed hearts believe stars guide us home hear heart radio beat playing chasing cars thought us back time lying next looked across fell love took hand back lamplit streets knew everything led back see stars amsterdam hear song heart beating open eyes see way horizons meet lights lead night know scars bleed hearts believe stars guide us home oh know oh know oh know oh oh oh see stars america	
['ed+sheeran']	...Baby One More Time	oh baby baby supposed know something right oh baby baby let go sight yeah show want tell baby need know oh loneliness killing must confess still believe still believe lose mind give sign hit baby one time oh baby baby reason breathe yeah got stranded oh pretty baby nothing would way planned show want oh tell babe need know oh loneliness killing must confess still believe still believe lose mind give sign hit baby one time oh baby baby supposed know oh pretty baby let go oh must confess loneliness killing hit baby one time loneliness killing must confess still believe still believe lose mind give sign hit baby one time lose mind give sign hit baby one time	
['ed+sheeran']	Shape Of You	club best place find lover bar go mmmm friends table shots drinking fast talk slow mmmm come start conversation trust give chance mmmm take hand stop put van man jukebox start dance singing like girl know want love love handmade somebody like come follow lead may crazy mind say boy let us talk much grab waist put body come follow lead come come follow lead mmmm love shape push pull like magnet although heart falling love body last night room bedsheets smell like every day discovering something brand new love body oh oh oh oh love body oh oh oh oh love body oh oh oh oh love body every day discovering something brand new love shape one week let story begin going first date mmmm thrifty go eat fill bag fill plate mmmm talk hours hours sweet sour family okay mmmm leave get taxi kiss backseat tell driver make radio play singing like girl know want love love handmade somebody like come follow lead may crazy mind say boy let us talk much grab waist put body come follow lead come come follow lead mmmm love shape push pull like magnet although heart falling love body last night room bedsheets smell like every day discovering something brand new love body oh oh oh oh love body oh oh oh oh love body oh oh oh oh love body every day discovering something brand new love shape come baby come come baby come come baby come come baby come come baby come come baby come come baby come come baby come love shape push pull like magnet although heart falling love body last night room bedsheets smell like every day discovering something brand new love body come baby come come baby come love body come baby come come baby come love body come baby come come baby come love body every day discovering something brand new love shape	
['ed+sheeran']	So	filled doubt move home want stay summer plan remember want see world please ask mother cannot hold hand watch go liar might know need need touch lips need smile acoustic version need smile kiss 2x cool beautiful see grace window late night show shadow place hope remember summers gone still sing song september acoustic versions verse see voice window late night show shadow plan remember want see world please ask mother cannot hold hand watch go liar might know need need touch lips need smile acoustic version need smile kiss 2x cool beautiful 2x words say mean amazing noticed lately need maybe cool beautiful	
['ed+sheeran']	Even My Dad Does Sometimes	alright cry even dad sometimes wipe eyes tears remind alive alright die deaths thing tried tonight hold live life like giving act like go ahead live go tear apart alright shake even hand sometimes inside rage dying light alright say deaths thing tried today hold live life like giving act like go ahead live go tear apart hold live life like giving act like go ahead live go tear apart hold	
['ed+sheeran']	Miss You	shock horror lost around lump chest sends cold head mind shuts sound autopilot tongues gone silent switch lay lay next know lost mind maybe made mine whoaohohoh know lost mind maybe every time said said said miss miss words mean nothing sitting fence used three words aching constrict suffocating mind racing picture painting bellys sick stomach remember times laid lay next know lost mind maybe made mine whoaohohoh know lost mind maybe every time said said said miss let kissed far long let go soon see know know lost mind maybe made mine whoaohohoh know lost mind maybe every time said said said miss miss whoaohohoh know lost mind maybe every time said said said miss	
['ed+sheeran']	Wild Mountain Thyme	oh summer time coming trees sweetly blooming wild mountain thyme grows around blooming heather would go lassie go go together wild mountain thyme grows around blooming heather would go lassie go build love bower  yon pure crystal fountain around place colors mountain would go lassie go go together wild mountain thyme grows around blooming heather would go lassie go true loves gone surely find another sing things make know want would go lassie go go together wild mountain thyme grows around blooming heather would go lassie go	
['ed+sheeran']	Sweet Mary Jane	woke early looking window amsterdam sky oh baby high last night café clouds red lights gotcha mind slowed time oh baby mind sing song cover hold tight drill deep chest that’s feels best remove scars stop breaking heart hurting spree brought worst ‘cause don’t want alone ‘cause everyday i’m breathing think one love way sweet words roll tongue feel flame wisdom fill lungs sweet mary jane won’t sing another song café clouds shooting stars floating across sky oh baby beautiful sight we’re satellites oh di ba di ba oh la lights oh baby damn high seen eyes beat beat heart take back start everything began holding inside hands fingers thumb seal tongue ‘cause don’t want alone ‘cause everyday i’m breathing think one love way sweet words roll tongue feel flame wisdom fill lungs sweet mary jane won’t sing another song na na na na na sweet mary jane na na na na na sweet mary jane na na na na na sweet mary jane na na na na na sing another song mary jane i’ve hoping alone mary jane since came along mary jane i’m almost home mary jane sing another song ‘cause everyday i’m breathing think one love way sweet words roll tongue feel flame wisdom fill lungs sweet mary jane won’t sing another song ‘cause everyday i’m breathing sweet mary jane love sound sweet words sweet mary jane feel flame wisdom fill lungs sweet mary jane won’t sing another song	
['ed+sheeran']	One Life	beautiful night make change lives east anglian sky empty bottle wine got side talking love life oh lucky look eyes wonderful way spend moment two lying awake talking got something say know got making change moment truth nervous things going perfect know worth spend forever count three get one knee ask darling honestly waited time make right ask tonight marry say yes one word one love one life gentle touch hand fingers running hair lips pressed lips oh caught unaware oh many times gazed eyes beautiful way spend rest life reappear burning auburn red chest pill bring us home bed last night night one last moment truth wonderful way fall deeper nervous things going perfect know worth spend forever count three get one knee ask darling honestly waited time make right ask tonight marry say yes one word one love one life hand mine things meant hearts intertwined things meant perfect time things meant oh things meant hand mine things meant hearts intertwined things meant perfect time things meant oh things meant	
['ed+sheeran']	Quiet Ballad Of Ed	shadow lies hope cut tension knife find hard cope stop playing life analyze fears analyze dreams choke burning tears silent screams things seem tell hundred craftsmen work tell army angels make breathe open doors take away key let see better watch fall stumble feet always losing game lies cut deep even know name consistency always watch crawl durability affected still things seem tell hundred craftsmen work tell army angels make breathe open doors take away key let see better feel pain brain feel strain start decay feel strain every passing day feel pain start decay tell hundred craftsmen work tell army angels make breathe open doors take away key let see better	
['ed+sheeran']	Afire Love	things good yesterday devil took memory fell death today hope heaven resting place heard doctors put chest pain could medicine lying bed either way cry rest father told son fault know face one although grandma used say used sing darlin hold arms way last night lie inside little oh could look eyes sun comes wrapped light life love put open lips mine slowly let shut designed together oh body next mine hearts beat one set alight afire love love love things good yesterday devil took breath away left pain black suit black tie standing rain family one stapled together strangers friend came mind paint pen six years old remember father told son fault know face one although grandma used say used sing darlin hold arms way last night lie inside little oh could look eyes sun comes wrapped light life love put open lips mine slowly let shut designed together oh body next mine hearts beat one set alight afire love love love see love love love love 3x father family rise seats sing hallelujah mother family rise seats say hallelujah brother family rise seats sing hallelujah brother sister yeah ah father family rise seats sing hallelujah love love love love 3x	
['ed+sheeran']	You Break Me 2	well friend seems we’ve come far disagree knees feel weak fell fast tide high swam deep catch breath tear apart piece piece take away mess could never think anything less ‘cos break numb still seem stun pain outrun left tide flows leave empty rooms spur left room long open wide lies flow eat whole know you’re cold said ‘i put away lies show there’s surprise me’ well still ‘cos break numb still seem stun pain outrun left exorcise demons keep talking believer believe relieve believe relieve that’s what’s going ‘cos break numb still seem stun pain outrun left break	
